,href,title,description
471,https://www.crowdfunder.co.uk/walk-up-moel-fam,Walk up Moel Famau for Liverpool Cricket Club,We need to raise money to fix our nets at Liverpool Cricket Club
472,https://www.crowdfunder.co.uk/foster-family-south-devon,Foster family in need of help,"Last Friday 22nd of May, our carers Giselle and Mark’s house burned down and they had to flee with only what they were wearing. They are ..."
473,https://www.crowdfunder.co.uk/dyzia-cat---marzena-oderisi,Dyzia Cat - Marzena Oderisi,"We all together save the cat Dyzia, who needs immediate surgery."
474,https://www.crowdfunder.co.uk/frogbox---london-itinerants-2,Frogbox - London Itinerants,Fund the LICCs Frogbox!
475,https://www.crowdfunder.co.uk/songforcornwall,Competing in Pan Celtic International Song Contest,Help us get to Ireland to represent Cornwall at The Pan Celtic International Song Contest with original song Kan an Teywn (Song of the Dune)
476,https://www.crowdfunder.co.uk/liams-charity-cycle-to-paris-fundraiser-1,Liams Cycle to Paris Charity Fundraiser,"On the 8th of June 2023, I will cycle 300km from London Gatwick to Paris over 3 days in aid of 3 amazing cancer charities."
477,https://www.crowdfunder.co.uk/ben-and-matts-copenhagen-marathon,Ben and Matts Copenhagen Marathon,Ben and Matt are raising money for our good friend Luke’s great charity Two Pints Deep which encourages men to speak in hard times.
478,https://www.crowdfunder.co.uk/cambourne-soul,Enhancing the space at Cambourne Soul,"Enhancing the space at Cambourne Soul Youth Centre for young people to socialise, stay warm, be fed and receive youth work support."
479,https://www.crowdfunder.co.uk/help-me-with-surgery,Help me with acl surgery,"I am aiming to acquire enough funds for surgery on my right knee, I tore my ACL, MCL & meniscus. The NHS waiting list is over a year."
480,https://www.crowdfunder.co.uk/our-cat-dexter-is-having-a-leg-amputated,Our cat Dexter is having a leg amputated,"Dexter was hit by a car and as a result, a big vet bill and needs his front leg amputating which we sadly cannot afford."
481,https://www.crowdfunder.co.uk/clackmannan-warm-space,Clackmannan Warm Space,"Our Warm Space is a safe, welcoming venue for anyone struggling with the cost of living, to access key outreach services and stay connected."
482,https://www.crowdfunder.co.uk/the-golf-trust-driving-change-prize-draw,The Golf Trust: Driving Change Prize Draw,I'm running this prize draw to raise money for grassroots golf programmes for disabled people.
483,https://www.crowdfunder.co.uk/restoring-liberty-to-the-heart-of-glastonbury,Restoring Liberty to the Heart of Glastonbury,Raising £2.2k to create a beautiful figure of Liberty holding the Torch of Knowledge & The Key of Avalon in the Heart of Glastonbury
484,https://www.crowdfunder.co.uk/orphanage-for-boys-bangladesh,Orphanage for Boys Bangladesh,"Assalaamu alaikum, I am raising funds to help towards building an orphanage in Bangladesh.  This is an extremely rewarding Sadaqah Jariah"
485,https://www.crowdfunder.co.uk/treeaction-uk,TreeAction -Watering solutions for our young trees,To provide sustainable watering solutions that enable new trees planted on public and school sites to survive and thrive.
486,https://www.crowdfunder.co.uk/ethc,Help launch Exeter Tiny House Community,"We need £2,000 to get Exeter Tiny House Community off the ground."
487,https://www.crowdfunder.co.uk/nansloe-nature-garden,"Help us Grow, at Nansloe!",We would like to raise enough money for a secure storage unit for our outdoor learning equipment! With a view to create a new school garden!
488,https://www.crowdfunder.co.uk/mental-health-conditions,Mental Health Conditions,THIS isn't something I'd do very often as I hate asking for help when it comes to money situations but... I am left with no choice.
489,https://www.crowdfunder.co.uk/birchvale-warm-space-cinema,Birchvale Warm Space Cinema,We want to welcome our community into a warm space where we will show classic movies for all ages.
490,https://www.crowdfunder.co.uk/supermarineseaplane,SUPERMARINE SEAPLANE,"Our purpose is flying, preserving, and celebrating the historic S5 Supermarine seaplane and help it regain its place as a British legend."
491,https://www.crowdfunder.co.uk/tq9-community-food-club-wellbeing-warm-space,TQ9 Community Food Club & Wellbeing Warm Space,Empowering TQ9 residents to maintain their food security and mental wellbeing during the Cost of Living Crisis and beyond.
492,https://www.crowdfunder.co.uk/st-chads-warm-welcome,St Chads Warm Welcome,St Chad's is a church at the heart of its community - our Warm Welcome project allows us to extend our welcome more widely!
493,https://www.crowdfunder.co.uk/mattwellyn,Staffordshire Buffalo Farm - Mattwellyn,We would like to raise money to help us buy a new (to us) tractor as sadly our old tractor is on its way out and is no longer fixable.
494,https://www.crowdfunder.co.uk/supporting-yeredzikan-charity,Supporting YereDzikan Charity,Our mentoring programme supports young women in the last years of high school providing them with guidance on how to navigate the world.
495,https://www.crowdfunder.co.uk/breadthatbonds,Bread that Bonds,"Bread that Bonds - bread making workshops that run over a two month period, focusing on individual Parent - Child relationship building."
496,https://www.crowdfunder.co.uk/bampots,Help Fund Bampots at The Edinburgh Fringe Festival,"Our aim is to gain enough funds to produce our brand new show ""BAMPOTS!"" at the Ed Fringe!"
497,https://www.crowdfunder.co.uk/ichiban-karate,Ichiban Karate Attending 2023 World Championships,We're raising enough funds to send our selected squad to the 11th WUKF World Championships in Dundee in July 2023.
498,https://www.crowdfunder.co.uk/mica-and-the-midnight-blue,Support Our EP! Female-Fronted UK Indie Folk Band!,Mica and The Midnight Blue have big plans for new music this year and need your help to take the next step.
499,https://www.crowdfunder.co.uk/wimborne-community-centre-warmer-spaces-support,Wimborne Community Centre: Warmer Spaces & Support,"Create a safe, warm space with food for those in need, offering skills for efficient & healthy cooking and also energy guidance and support."
500,https://www.crowdfunder.co.uk/help-me-get-to-australia-november-2023,Help me get to Australia for my mini speaking tour,"I want to bring the the truth of what the controlled, corporate music industry is REALLY all about to an Australian audience."
501,https://www.crowdfunder.co.uk/talking-drugs-schools-programme,Talking Drugs Schools Programme,"Aim is to help reduce alcohol & drug deaths in Scotland via education, intervention & prevention - with your help, we can & will save lives."
502,https://www.crowdfunder.co.uk/pac-warm-space-community-cafe,Pocklington Arts Centre Warm Space Community Cafe,"We are opening Tue, Thu and Fri mornings to offer FREE activities for the local community - a space to meet, chat over a cuppa and join in."
503,https://www.crowdfunder.co.uk/shoot73-off-the-ground,Getting our studio off the ground!,We would like financial support to help us adequately equip our studio to a standard that can support our local community.
504,https://www.crowdfunder.co.uk/call-me-suicidal-1,Call Me Suicidal,"When Death calls for Liv, she doesn't expect her to be such a bitch. Call Me Suicidal explores the inconvenience of being alive."
505,https://www.crowdfunder.co.uk/donate-for-mennas-journey-in-the-united-nations,Donate for Menna's Journey in the United Nations!,We aim to fund Menna's participation in the Graduate Study Programme at the UN in Geneva to pursue the cause of justice for Palestine.
506,https://www.crowdfunder.co.uk/c2r-crowdfunder---regional-programme-project,C2R Crowdfunder - Regional Programme Project,To support veterans through the year round C2R Regional Programme and to provide the community and training to improve members lives.
507,https://www.crowdfunder.co.uk/trcc-matting-for-outdoor-nets,TRCC matting for outdoor nets,TRCC needs new matting for one of its outdoor nets. After many years of use the current matting has worn and is no longer fit for purpose.
508,https://www.crowdfunder.co.uk/concerts-dont-cost-the-earth-kickstarter,Concerts Don't Cost The Earth Kickstarter,We are an environmental concert series which exists to start conversations about the climate crisis through the power of music.
509,https://www.crowdfunder.co.uk/lawn-shelter-for-enfield-croquet-club,Lawn Shelter for Enfield Croquet Club,We want to build a small shelter on the lawns so that club members and visitors have somewhere to sit and shelter from the rain.
510,https://www.crowdfunder.co.uk/bliss-1,"Supporting the 90,000 premature or sick babies","We need your help to make sure our support is accessible and inclusive to all families, improving the outcomes for premature or sick babies."
511,https://www.crowdfunder.co.uk/help-invisible-glasgow-train-new-guides,Help Invisible (Glasgow) Train New Guides!,We would like to start training a brand new group of people who have experienced homelessness to become tour guides of Glasgow!
512,https://www.crowdfunder.co.uk/just14themoviepreproductionfund,Just 14 The Movie Pre Production Stage,"Following a successful, awarding winning, promotional trailer we are now moving into pre-production stage of this football related movie."
513,https://www.crowdfunder.co.uk/this-community-heart-needs-to-keep-beating,This Community Heart needs to keep beating,"To ensure the Communities heart continues to beat. Bringing hope, help and empathy alongside practical assistance. Help us to help others."
514,https://www.crowdfunder.co.uk/a-plaque-for-thich-nhat-hanh,A Plaque for Thich Nhat Hanh,To lay a small stone plaque by a new plum tree in the meadows in Edinburgh to commemorate Thich Nhat Hanh's visit in 2003.
515,https://www.crowdfunder.co.uk/rondo-revamp,Rondo Revamp!,WE NEED YOUR HELP TO GIVE OUR BEAUTIFUL THEATRE A NEW LEASE OF LIFE.
516,https://www.crowdfunder.co.uk/mike-antrobus,Mike Antrobus,To raise money for Mike to start again after fire.
517,https://www.crowdfunder.co.uk/support-to-community-youth-theatre,Support to community youth theatre,To provide near professional facilities and guidance in musical theatre to the youth of our community at the lowest price.
518,https://www.crowdfunder.co.uk/hccscoffeeafternoon,Friday Coffee Afternoons,HCCS aims to provide a safe warm space to our elderly East and South East Asian community members to have a hot drink and chat freely!
519,https://www.crowdfunder.co.uk/keep-lancaster-city-council-green,Keep Lancaster City Council Green!,"In Lancaster District, every council seat is up for re-election on 4th May - we need your help to keep Lancaster City Council Green led!"
520,https://www.crowdfunder.co.uk/cleanoceansailing,Recovering Boat Wreckages from The Helford and Fal,"Our aim is to locate and remove the many boat wreckages in the Helford River and Fal, to prevent plastic pollution and protect wildlife."
521,https://www.crowdfunder.co.uk/turnip-towers-photography-start-up,Turnip Towers Photography start-up,"In order to start a photography business after being made redundant, I need to replace my old DSLR which has taken 500.000 photographs"
522,https://www.crowdfunder.co.uk/windmill-hill-camping-gear-appeal,Windmill Hill Camping Gear Appeal,We are looking to raise the funds to be able to buy camping equipment. The experiences we can offer our children with this will be amazing
523,https://www.crowdfunder.co.uk/the-leeds-peoples-gym,The Leeds People's Gym,"We want to create a safe, open, accessible space for ALL people in Leeds to achieve their goals in a comfortable and welcoming environment."
524,https://www.crowdfunder.co.uk/get-greens-elected-south-and-vale,Help Us Get Greens Elected in South and Vale,Help us get more Greens elected to South Oxfordshire and Vale of White Horse District Councils.
525,https://www.crowdfunder.co.uk/wordmakers-silence-breakers,The Wordmakers Collective Cash Grab,to level up from a DIY collective to nurture & develop local creatives and offer paid work to artists by curating 4 outstanding live shows
526,https://www.crowdfunder.co.uk/rose-reach-and-support-each-other,R.O.S.E  reach and support each other,"The projects aim is to support people in need. I am a not for profit , voluntary group. I am not in association with any other charities ."
527,https://www.crowdfunder.co.uk/pollito-locos-quest-for-a-greener-future,Pollito Loco's quest for a greener future,"Our dream to become a truly sustainable, zero waste food business needs your help to push our food truck along the way!"
528,https://www.crowdfunder.co.uk/lote-tree-foundation,Lote Tree Foundation,Help to support the ongoing work of Lote Tree Foundation in serving the Manchester Community!
529,https://www.crowdfunder.co.uk/chile-50-years-uk,Chile 50 years UK,Fund the wave of cultural and politics activities taking place this year to mark 50 years since the bloody coup in Chile.
530,https://www.crowdfunder.co.uk/ben-to-bbc-gardeners-world-live,Let’s get Ben to BBC Gardeners World to design!,"Ben has the chance to change his career & fulfil a dream he never thought was possible, but he now need your help more than ever!!"
531,https://www.crowdfunder.co.uk/trees-to-shield-and-cool-450-primary-schoolers,Trees to shield and cool 450 primary schoolers,"Planting climate adapted trees, to cool the school's building and yard during heatwaves, reduce flooding risks and improve air quality."
532,https://www.crowdfunder.co.uk/childrens-science-week,Children's Science Week,"We are delivering a Children's Science Week. Featuring amazing authors, scientists, professors and doctors visiting schools across the area."
533,https://www.crowdfunder.co.uk/bury-folk-festival-2023,Bury Folk Festival 2023,"This is our first Festival without our leader and sponsor, Steve Martin, who died in December. Help us to secure the future of the Festival."
534,https://www.crowdfunder.co.uk/john-j-morris-diaries,John J Morris diaries,"Preservation of a Lanivet man's 42 handwritten diaries, spanning from1913-1981. Once stabilised they will be digitalised & available online."
535,https://www.crowdfunder.co.uk/cant-wait-to-leave-edinburgh-fringe,Can't Wait To Leave at the Edinburgh Fringe 2023,We're taking the phenomenal debut play Can't Wait To Leave to the Edinburgh Fringe 2023 - but we need your help to do it.
536,https://www.crowdfunder.co.uk/hafsa-quran-academy,Hafsa Qur’an Academy,"Initiatives for the young, sisters empowerment & brothers going through mental health challenges."
537,https://www.crowdfunder.co.uk/thornbury,The Thornbury Primary School Fundraiser,To support the mental and physical health of the pupils by hosting an inspirational workshop.
538,https://www.crowdfunder.co.uk/umaamah-husna,Umaamah & Husna,"Assalamu alaikum! During the blessed month of Ramadan, Umaamah & Husna  has been challenged to memorise the 99 names of Allah, Most High."
539,https://www.crowdfunder.co.uk/andy-jurd,Andy Jurd,In memory of some wonderful colleagues who sadly passed in recent years and for all those who have suffered or are suffering from cancer.
540,https://www.crowdfunder.co.uk/community-welcome,Pype Hayes U R C Community Welcome,"To develop Wednesday Welcome (warm space) into an all year round activity, encouraging all ages to meet together in a safe, caring space."
541,https://www.crowdfunder.co.uk/low-energy-floodlighting---kings-norton-rugby-club,Low energy floodlighting - Kings Norton rugby club,We have old floodlights which we want to replace by LED lights reducing electricity consumption by over 75% - key to keeping the lights on.
542,https://www.crowdfunder.co.uk/pheonyx2,Pheonyx Unit 2,My project aim is to relocate the gym and make it better than ever!
543,https://www.crowdfunder.co.uk/percysroof,Replacing my roof after scammers wrecked it,"Emergency repairs to seal the roof, which is currently leaking straight into the house."
544,https://www.crowdfunder.co.uk/curves-irvinepaisley-in-aid-of-haus-of-seisay,Curves Irvine/Paisley in aid of Haus of Seisay,Curves Irvine and Paisley members are taking on the 2023 kiltwalk in aid of Haus of Seisay
545,https://www.crowdfunder.co.uk/helping-a-friend-after-his-cancer-diagnosis,Helping a friend who has cancer,I am helping Tim who is having cancer treatment and assisting implementation of sustainability initiatives into his business as he recovers.
546,https://www.crowdfunder.co.uk/youth-play-sessions-for-disabled-children,Youth & Play Sessions for Disabled Children,"Our project aims to support children & young people with disabilities and additional needs to: play, socialise and learn new skills"
547,https://www.crowdfunder.co.uk/help-lsh-get-to-twickenhamsixways,Help us get to Twickenham & Sixways!,Help raise money for our Ladies & U18s girls National Final at Twickenham & Sixways!
548,https://www.crowdfunder.co.uk/prenatal-paternity-test,Prenatal,…..
549,https://www.crowdfunder.co.uk/ysfc-yes-stickers,Yes - South Fife Coast - Yes Stickers,It's time to make the campaign for Scottish independence visible again. We aim to print as many Yes stickers as we can distribute.
550,https://www.crowdfunder.co.uk/cheetham-hill-squash-club-1,Cheetham Hill Squash Club,"Raise funds to make our club more sustainable, and to continue to grow our club!"
551,https://www.crowdfunder.co.uk/team-tamworth,Team Tamworth,"I'm raising money for my gymnastics club, Tamworth Olympic Gymnastics Club."
552,https://www.crowdfunder.co.uk/irlam-steele-fc-go-international,Irlam Steele JFC are going INTERNATIONAL ⚽️!,"Our Boys are going to BARCELONA… WE hope! If you could please sponsor them, even a little, it’s a HUGE opportunity to play internationally!"
553,https://www.crowdfunder.co.uk/help-us-get-more-green-councillors-elected-2,Help us get more Green Councillors elected!,Please help us to get more Greens elected to Tewkesbury Borough Council.
554,https://www.crowdfunder.co.uk/excess-skin-removal-from-32st9207kg---15st196kg,"Excess skin removal, from 32st9/207kg - 15st1/96kg",I'm desperate to get enough money to have a full body sculpt/contouring procedue but any funds towards even an abdominoplasty would be great
555,https://www.crowdfunder.co.uk/these-stories-we-tell,These Stories We Tell - A New Dance Theatre Work,We plan to work with 14-18 year olds to create a new dance performance  around traumatic events and the stories we tell ourselves to cope.
556,https://www.crowdfunder.co.uk/teesside-twin-top-challenge,TEESSIDE TWIN TOP CHALLENGE,"Two reasons; 1) Raise money for James Cook Neonatal Unit 2) Support England kettlebell athletes to get to The European Championships, Greece"
557,https://www.crowdfunder.co.uk/new-terrain-at-westow-cricket-club,Relocate Petanque Terrain,Relocate from our existing terrain to a new purpose built terrain which will be located at Westow Cricket Club and Community Pavillion
558,https://www.crowdfunder.co.uk/alan-turing---a-musical-biography-1,Alan Turing - A Musical Biography,Join us... Alan Turing - A Musical Biography is returning to the Edinburgh Festival for its second time with a new script and new songs.
559,https://www.crowdfunder.co.uk/2020musicaledinburgh,Help Natasha get her musical to EDINBURGH FRINGE,I would love to raise the funds to be able to afford to take my musical to The Edinburgh Fringe and pay all professionals involved
560,https://www.crowdfunder.co.uk/friendsoftayyibah,Visualisers for an Islamic Girls School,Buy Visualisers and other resources for Tayyibah Girls School
561,https://www.crowdfunder.co.uk/coffee-concert,Coffee Concert,"We are holding a concert in our home, in April, to raise funds to support children and young people in Tanzania."
562,https://www.crowdfunder.co.uk/orphanage-a-home-and-hifz-madrassa-for-boys,"Orphanage, A Home and Hifz Madrassa for boys",I am raising donations for an Orphanage for boys in Sylhet Bangladesh with Pathway to Jannah.  100% Donation policy
563,https://www.crowdfunder.co.uk/sefton-green-party-local-elections-fundraiser-2023,Sefton Green Party Local Elections Fundraiser 2023,Sefton Green Party Local Elections 2023 Fundraiser
564,https://www.crowdfunder.co.uk/coming-together-as-a-community-to-help-a-family-1,Coming together as a community to help a family,To raise money to help fix damage and make their home fit for purpose again
565,https://www.crowdfunder.co.uk/london-to-paris---200-mile-cancer-charity-ride,London to Paris - 200 Mile Cancer Charity Ride,"On June 8th, a team of 60 riders will set off from Air Partner in London Gatwick and cycle to Paris in aid of 3 amazing cancer charities"
566,https://www.crowdfunder.co.uk/back-2-eu,Back 2 EU - Citizen of Europe ID Cards & more.,Back 2 EU is a project from I Heart EU who aim to make the rejoin campaign as visible as possible. Limited edition rewards are available.
567,https://www.crowdfunder.co.uk/workington-unit-ongoing-costs,Workington Unit Ongoing Costs,WE WANT TO KEEP WORKINGTON CADETS AFLOAT - Help pay for our running costs to ensure our cadets future!
568,https://www.crowdfunder.co.uk/celtic-wheel-of-the-year-suite-album-recording,Celtic Wheel of the Year Suite: Album Recording,"I plan to record my new suite of music, an ambitious hybrid classical/jazz work, inspired by the natural rhythms of the earth."
569,https://www.crowdfunder.co.uk/help-solihull-green-party-to-keep-growing,Help Solihull Green Party to keep growing.,Our aim is to raise funds to help us campaign for more elected Green Party representation in Solihull.
570,https://www.crowdfunder.co.uk/dance-for-ukraine-fitness-fundraiser,Dance For Ukraine - Fitness Fundraiser,I have got together a group of top class instructors for a fitness fundraiser. We will be raising money for Driving Aid to Ukraine.
571,https://www.crowdfunder.co.uk/community-meadow-rewilding-workshops-in-cornwall,Community Meadow Rewilding Workshops in Cornwall,"Our Community Meadow is led by volunteers for the community, connecting people of all ages with nature.  We host workshops and activities."
572,https://www.crowdfunder.co.uk/three-peaks-of-burnham-challenge,Three Peaks of Burnham Challenge,Staff and students will walk the 'three peaks of Burnham' to raise money to go towards our End of Year Celebration!
573,https://www.crowdfunder.co.uk/music-for-the-golden-oldies,Music for the Golden Oldies,To raise funds to help us continue this project
574,https://www.crowdfunder.co.uk/inherhandsproject,In Her Hands - Empowering Through Building and DIY,In Her Hands is a non-profit CIC that aims to empower women & gender marginalised folk through teaching fundamental building and DIY skills
575,https://www.crowdfunder.co.uk/cf3-cody-fishers-anti-knife-crime-foundation,CF3Cody Fishers anti knife crime foundation,Hi I am Cody Lees mum Tracey.  We are hoping to set up a foundation for my gorgeous boy Cody who was cruelly taken from us on Boxing Day
576,https://www.crowdfunder.co.uk/gravesham-wellness-space-extra-funding,Gravesham Wellness Space EXTRA FUNDING,To complete our Wellness Space and install a disabled toilet plus Sensory Pod.
577,https://www.crowdfunder.co.uk/sponsored-walk-14,Sponsored Walk,Formby Cricket Club members will be doing a sponsored walk on Good Friday. 10 miles and 20 mile options
578,https://www.crowdfunder.co.uk/guffy-theatre-play-edinburgh-festival-fringe-2023-1,Guffy Theatre Play Edinburgh Festival Fringe  2023,"Guffy is my first play and I will be directing and producing aswell.I aim to raise funds to cover rehearsals, costumes, set and travel."
579,https://www.crowdfunder.co.uk/gatwick-to-paris-charity-bike-ride-3,Tom's Gatwick to Paris Charity Bike Ride,"This June, I'm cycling 300km over three days, from London Gatwick to Paris, in aid of three amazing cancer charities."
580,https://www.crowdfunder.co.uk/get-up-give-back-2023---hike-against-hunger-21,Get Up Give Back 2023 - Hike Against Hunger,"Our aim is to raise £127,264 in only 12 weeks! We'll be pushing ourselves physically & mentally, raising funds for food. #HikeAgainstHunger."
581,https://www.crowdfunder.co.uk/june---edinburgh-fringe-2024-fundraiser,June - Edinburgh Fringe 2023 fundraiser,We are fundraising to take our play to the Edinburgh Fringe in August 2023.
582,https://www.crowdfunder.co.uk/vespa-top-speed-world-record,Vespa top speed world record,my Aim is to take my full frame geared Vespa to 130 mph and break the current UK record of 122 mph.
583,https://www.crowdfunder.co.uk/worcester-8000-life-boiler-install-worth-45k,Prize Draw Worcester 8000 Boiler & Install (4.5K),"Energy Made Greener donated a boiler and installation worth  4,500 (at a cost to themselves) to raise funds to keep local lad Cole alive."
584,https://www.crowdfunder.co.uk/belfast-marathon-for-cuan-mhuire-newry-rehab,"Belfast Marathon'23 Cuan Mhuire, Alcohol Addiction",To raise money for the residential rehab that saved my life / gave me life. My life is beyond my wildest dreams in recovery. Thank you
585,https://www.crowdfunder.co.uk/please-buy-me-a-drink-to-help-me-study,Please buy me a drink to help me study,"TOTAL REACHED. THANK YOU xxxxxHello Lovely Friends,I'm asking for your help to get me my dream job and all it will cost you is a drink......"
586,https://www.crowdfunder.co.uk/lilyscafeandbar,Lily's Cafe and Bar,"Lily's Cafe and Bar is a queer women-focused space, which is also inclusive of and supported by the LGBTQ+ community and its amazing allies!"
587,https://www.crowdfunder.co.uk/trike-for-meic---special-bike-for-my-pensioner-dad,trike for meic - special bike for my pensioner dad,"I’m raising money to buy my dad an adult tricycle. He suffers with sciatica and arthritis which means he is often in pain, can’t walk ve..."
