,href,title,description
0,https://www.crowdfunder.co.uk/free-assange,Help campaign to Free Julian Assange,Help campaign to Free Julian Assange and Stop the Extradition to the United States. Julian's life and your rights are at stake!
1,https://www.crowdfunder.co.uk/blackout2023,Black Out 2023 | Cannes Lions Festival,Taking Black talent connected to the creative industry or interested in it to the Cannes Lions International Festival of Creativity.
2,https://www.crowdfunder.co.uk/50-days-to-make-a-difference,50 Days to Make a Difference,Our scientists curate a portfolio of effective climate charities. They're asking everyone to donate in the 50 days before Earth Day.
3,https://www.crowdfunder.co.uk/saveside,#SAVESIDE,"As of 9th April 2023, Side Gallery will close to the public due to critical funding cuts and the cost of living crisis. Help us #SaveSide"
4,https://www.crowdfunder.co.uk/lets-smash-the-political-silence-on-brexit,Let's smash the political silence on Brexit,"Everyone knows Brexit isn't working, but politicians won't face up to reality. This has to change. Chip in to make it happen."
5,https://www.crowdfunder.co.uk/save-sutton-community-farm,Save Sutton Community Farm,Donate to Sutton Community Farm's Crowdfunder to support a positive future for all! #SaveSuttonCommunityFarm
6,https://www.crowdfunder.co.uk/new-golf-gym---llantrisant-and-pontyclun-juniors,New Golf Gym - Llantrisant and Pontyclun juniors,We want to create an inclusive new gym and locker room to help our junior section expand and thrive!
7,https://www.crowdfunder.co.uk/the-destiny-campus-community-project-2,The Destiny Campus Community Project,Serving our community with love; bridging poverty and discrimination gaps. Improving financial and physical wellbeing in the midst of crisis
8,https://www.crowdfunder.co.uk/together-through-tough-times,TOGETHER THROUGH TOUGH TIMES,"Develop practical, inclusive & accessible ideas to reduce household expenditure whilst developing skills to manage budgets and avoid debt."
9,https://www.crowdfunder.co.uk/food-9,Eat More for Less,"Helping families make budget friendly choices with their weekly groceries; helping them buy healthful, low cost item each week."
10,https://www.crowdfunder.co.uk/csaa-food-bank,# Stop Hunger! Food and Support For People in Need,We are raising money to provide a food parcels and practical support to families suffering from poverty
11,https://www.crowdfunder.co.uk/crowdfunder-cost-of-living-emergency-fund,Cost Of Living Emergency Fund,Millions of UK households are facing rising living costs. Donate now to help those in need.
12,https://www.crowdfunder.co.uk/hillingdon-samaritans-anniversary-fund,Samaritans of Hillingdon Anniversary Fund,To raise the funds needed to maintain our core services and invest in our premises to ensure these are fit for purpose for the future
13,https://www.crowdfunder.co.uk/air-partner-gatwick-to-paris,Air Partner Gatwick to Paris Charity Bike Ride,"On the 8th of June, a team of 60 riders will set off from Air Partner in Gatwick and cycle to Paris in aid of 3 amazing cancer charities."
14,https://www.crowdfunder.co.uk/penistone-cricket-club-new-pavilion,Penistone Cricket Club New Pavilion,Penistone CC urgently require a new pavilion as the current one is in disrepair and is no longer fit for purpose.
15,https://www.crowdfunder.co.uk/the87press2023,the87press 2023 Book Subscription Crowdfund,At the87press we are offering book subscriptions and bundles for our next cycle of publications (Autumn 2023–Spring 2024).
16,https://www.crowdfunder.co.uk/stop-racist-hate-dividing-our-communities,Stop racist hate dividing our communities,"The far right are stoking hate against refugees, asylum seekers and migrants. We need your help to counter these racist messages."
17,https://www.crowdfunder.co.uk/brooklandstenniscrowdfunding,Brooklands Tennis Court Improvements and Shelter,We are raising funds to make 4 of our courts safe to play on again and for a new shelter near the courts
18,https://www.crowdfunder.co.uk/kitchen-therapy-east-kent,Kitchen Therapy East Kent,To change a space: Expand our Community Deli and create a Children's Cookery School with an Arts & Nature-Based Activity Centre
19,https://www.crowdfunder.co.uk/ocean-plastic-pots---invest-in-recycling-equipment,Recycling Equipment for Beach Plastic,We manufacture plant pots from rope and fishing net collected from Scottish beaches.... now we want to recycle the hard plastics as well.
20,https://www.crowdfunder.co.uk/long-eaton-cricket-club-new-facilities,Long Eaton Cricket Club - New Training Facility,"Long Eaton Cricket Club , with your support is trying to raise £100,000 to enhance our existing facilities."
21,https://www.crowdfunder.co.uk/bridgwater-cf23,Bridgwater Cricket Facility Refurbishment,Raise money to complete a much needed refurbishment on our double lane astro nets and improve the safety netting on the Wyndham Park ground
22,https://www.crowdfunder.co.uk/hwb-y-gors-1,Hwb y Gors: Net Zero Community Hub,"Transforming the former Cwmgors primary school into a thriving Net Zero hub for arts, education and enterprise – for everyone."
23,https://www.crowdfunder.co.uk/wizard-works-x-fairlight-cyclone-relief,Wizard Works X Fairlight NZ Cyclone Relief,Win a Fairlight Secan 2.5 Frameset and Wizard Works bags in support of The Hawkes Bay Foundation Cyclone Gabrielle Relief
24,https://www.crowdfunder.co.uk/church-broughton-tennis-club-clubhouse-appeal,Church Broughton Tennis Club Clubhouse Appeal,"Replace our small, dilapidated, wooden chalet and outdoor Portaloo with a heated, safe, secure clubhouse with toilet facilities"
25,https://www.crowdfunder.co.uk/brass-blast,BRASS BLAST all-welcome youth band!,"Accessible, inclusive and creative music making for young people aged 9-18. Help us continue our programme beyond August 2023!"
26,https://www.crowdfunder.co.uk/tbf-pantry,TBF Pantry,We are looking to open a non referral food-bank in our store to help those in need
27,https://www.crowdfunder.co.uk/re-open-p-franco,Re-Open P Franco,Re-open the doors of P Franco
28,https://www.crowdfunder.co.uk/operation-nets,Operation Nets,"We are aiming to raise £20,000 to build state of the art cricket nets."
29,https://www.crowdfunder.co.uk/stockton-hockey-club-ground-improvement-2,Stockton hockey club ground improvement,We aim to improve the fencing around Egglescliffe school to protect buildings & neighbours. Also build a covered spectators area.
30,https://www.crowdfunder.co.uk/spirit-ridge,Spirit Ridge (In The Footsteps Of The Lion Tamer),"Help me record my next album at the atmospheric Crinale Studio near Bologna (Italy), with musician/ producer/ film-maker Antonio Gramentieri"
31,https://www.crowdfunder.co.uk/neston-club---renovation-of-old-pavilion-2023,Neston Club - Renovation of old pavilion 2023,Our aim is to renovate our 100 year old pavilion to become a fantastic dedicated indoor multi sports and social space for all ages
32,https://www.crowdfunder.co.uk/thelink,The Link - church & community hub for Ashbourne,Our church and community hub will make a significant contribution to the revitalization of Ashbourne town centre as part of Ashbourne Reborn
33,https://www.crowdfunder.co.uk/wigtonclubhub,Wigton Club Hub,Improve community facilities for all users of the club.
34,https://www.crowdfunder.co.uk/perivale-taproom-transformation,Perivale Taproom Transformation,"We want to transform our taproom on Horsenden Farm.  Creating a covered, heated area you can enjoy our beers in all year round."
35,https://www.crowdfunder.co.uk/help-us-save-scotts-sustainable-woodland,Save Scott's sustainable woodland business...,help get a pioneering sustainable forestry and woodcraft business back on its feet after a huge fire ripped out the heart of his operation.
36,https://www.crowdfunder.co.uk/winasone,We must Win As One and change politics for good,"Donate to our fighting fund. Not just to change the government, but to change politics - starting with Proportional Representation."
37,https://www.crowdfunder.co.uk/almanaccafeonewithnature,Almanac Cafe - One with Nature,"Help us build Almanac, a beautiful new cafe for Plymouth featuring fresh locally grown foods to guide you on adventures through the seasons"
38,https://www.crowdfunder.co.uk/of-the-land,Of the Land by Gartur Stitch Farm,Spend a penny to spend a penny! Help us upgrade our loo facilities and event barn to make visits more comfortable.
39,https://www.crowdfunder.co.uk/six-inches-of-soil-post-production,Six Inches of Soil Film - Post Production,Help us complete the first major documentary feature film about the regenerative farming revolution in Britain.
40,https://www.crowdfunder.co.uk/urgent-help-needed-now-for-ukraine-children,URGENT: Help Ukraine's Children,Children in Ukraine are suffering and so is their education. Schools have been hit by missiles. They desperately need your support
41,https://www.crowdfunder.co.uk/lisburn-bmx-club-revitalization,Lisburn BMX Club Revitalization,Our project is aimed at enhancing biodiversity through the revitalization of areas within the facility
42,https://www.crowdfunder.co.uk/togc-bounce-back,Help TOGC Bounce Back Bigger and Better!,At Tamworth Olympic Gymnastics Club we want to 'BOUNCE BACK' BIGGER & BETTER after smoke damage closed our gym on the 7th Jan '23.
43,https://www.crowdfunder.co.uk/open-for-community,Open for Community,"Our project ""Open for Community"" will upgrade our 1874 premises, reduce our carbon footprint and improve environmental sustainability."
44,https://www.crowdfunder.co.uk/hungry-for-change,Hungry for Change!,We need to fund our film about the climate impacts of our broken food system... and the amazing people in Cornwall working to tackle it!
45,https://www.crowdfunder.co.uk/lifeatno27-brynawel-house-therapy-garden,Therapy Allotments for Brynawel House,"Life at No.27 needs to build a new therapy garden, offering free & low-cost mental health support and gardening therapy to all ages in need."
46,https://www.crowdfunder.co.uk/yemen-emergency-appeal-medical-food-aid,Yemen Emergency Appeal (Medical & Food Aid),Marwa Relief is raising funds to urgently support families & children suffering in Yemen.
47,https://www.crowdfunder.co.uk/unravellingshortfilm,UnravellingShortFilm,SHORT HORROR FILM - aiming to raise awareness around Multiple Sclerosis and its effects on those who suffer from it.
48,https://www.crowdfunder.co.uk/koba-ko-ramen-bar,Koba-Ko Ramen Bar,"Koba-Ko has secured a permanent location in Kings Heath, Birmingham to open a ramen bar and we are in need of your help to make it happen!"
49,https://www.crowdfunder.co.uk/govanhill-community-cinema,Govanhill Community Cinema,"We are crowdfunding to support the development of a Community Cinema in our neighbourhood of Govanhill, Glasgow"
50,https://www.crowdfunder.co.uk/gendergp,Help trans youth access lifesaving medical care,Work with Susie Green to help fund essential and life-saving healthcare for trans youth and their families.
51,https://www.crowdfunder.co.uk/findlaynapieroutsider,Findlay Napier's Outsider Project,"""Outsider"" is a multi-media extravaganza of new album from Findlay Napier exploring outsiders in love and outsiders in life."
52,https://www.crowdfunder.co.uk/helping-hedgehogs-thrive-again,Helping Hedgehogs Thrive Again,"In the last 20 years, hedgehog numbers have dropped by a third in urban areas and by half in rural areas. We must help save hedgehogs."
53,https://www.crowdfunder.co.uk/bristolgreenleaders,Green Leaders for Bristol and the West of England,"We're fundraising to elect the first Green Mayor in Bristol, plus Green leaders for the West of England region and Avon & Somerset Police"
54,https://www.crowdfunder.co.uk/growing-the-insect-super-highways,Growing the insect super highways,To grow the mapped B-Lines network across the UK  by enabling Buglife to build on the ground partnerships  of landowners and funders.
55,https://www.crowdfunder.co.uk/the-granville-pugin-studios,Pugin Studios at The Granville Hotel,"Help us save Kent's heritage! We are currently working on a couple of projects in Kent, starting with Pugin Studios. Find out more below."
56,https://www.crowdfunder.co.uk/lochinshdryslope,To Resurface & improve gradient of Loch Insh slope,"We need your help to replace our ageing artificial ski slope with a new, extended, state-of-the-art and climate-ready facility."
57,https://www.crowdfunder.co.uk/the-wash-house-garden-growing-food-and-community,The Wash House Garden - Growing Food and Community,"We are raising money to keep our community garden in the East End of Glasgow going, to keep feeding local people and offer a community space"
58,https://www.crowdfunder.co.uk/get-elizabeth-to-japan,Get Elizabeth to Japan,Help Elizabeth fulfill her lifelong dream of visiting Japan
59,https://www.crowdfunder.co.uk/a-developing-and-improving-moseley-ashfield-cc,A developing and improving Moseley Ashfield CC,The club intends to further grow its cricket offer in 2023 and with that ensure that the facilities are welcoming and inclusive.
60,https://www.crowdfunder.co.uk/the-backstreet,The Backstreet Film,"This short documentary celebrates the iconic club The Backstreet and its unique community. An exploration of desire, kink and friendship."
61,https://www.crowdfunder.co.uk/croesyceiliog-afc-clubhouse-improvements,Croesyceiliog AFC Clubhouse improvements,We need the community help to repair our damaged roof and enable all our users safe access to the clubhouse and changing rooms
62,https://www.crowdfunder.co.uk/fund-feminist-politics,Fund feminist candidates in local elections,The Women's Equality Party is fundraising to ensure feminist candidates are elected to local councils across the UK.
63,https://www.crowdfunder.co.uk/supportmusic,"Music Broth - Can we play it?  Yes, we can!","Help our musical instrument library to enable and encourage more people to meet, jam, collaborate, create, repair instruments and have fun!"
64,https://www.crowdfunder.co.uk/ultra-education---youth-entrepreneurship-workshops,Ultra Education - Youth Entrepreneurship Workshops,"Help fund a series of Entrepreneurship workshops in a warm space for children & young people, at new offices right next to Wembley Stadium"
65,https://www.crowdfunder.co.uk/waringstown-cricket-club---women-and-girls,Waringstown Cricket Club - Women and Girls,Waringstown Cricket Club aim to use this crowdfunding project to help support the growth and development of our women and girls sections.
66,https://www.crowdfunder.co.uk/help-us-build-safe-spaces-for-girls-in-lebanon,Help us build safe spaces for girls in Lebanon,"Help us work with teenage girls to promote gender equality in vulnerable neighbourhoods of Lebanon, one public space at a time!"
67,https://www.crowdfunder.co.uk/changing-rooms-for-new-pitch,New Changing Rooms with Privacy for New Pitch,"To build two new changing rooms with privacy for men, women and juniors"
68,https://www.crowdfunder.co.uk/base51nottingham,Save Our Youth Club,To support hundreds of vulnerable 11-25 year olds in Nottingham and Nottinghamshire.
69,https://www.crowdfunder.co.uk/east-brighton-food-co-operative-1,EBFC - Citywide Community Meals on Wheels Service,"Continuing our Community, Citywide, Fresh & Nutritious Daily Meals on Wheels service for those at risk of malnutrition in Brighton & Hove."
70,https://www.crowdfunder.co.uk/junior-plate-finches,Women's Junior Plate Final,Help get the Finches to the Final!!
71,https://www.crowdfunder.co.uk/east-belfast-gaa-building-together-2023,East Belfast GAA - Together 2023,Help marginalised girls & women access sport & support new volunteers from all communities providing diverse role models at EBGAA post Covid
72,https://www.crowdfunder.co.uk/st-marys-aughlisnafin---healthy-bodies-and-minds,St Mary's Aughlisnafin - Healthy bodies and minds,The Friends Of The Fin are looking to raise funds to support develop sports through new equipment and fitness sessions from Bee Active NI.
73,https://www.crowdfunder.co.uk/thecarousel,Community Work Day,"In a world which is becoming more remote, Community Work Day aims to bring people together."
74,https://www.crowdfunder.co.uk/ci-sixers---blasting-through-covid-and-beyond,CI Sixers: blasting beyond COVID,To deliver a new girls' cricket team at U15 level through focussed coaching at the club and engaging local girls' secondary schools.
75,https://www.crowdfunder.co.uk/save-the-change-is-possible-project,Save the 'Change is Possible Project',Help us to ensure the Change is Possible Project survives to continue to help those forgotten members of our society who need it most.
76,https://www.crowdfunder.co.uk/protect-public-right-to-environmental-information,Protect public right to environmental information,The Environmental Information Regulations 2004 are on a list of leglislation that Defra is currently considering scrapping.
77,https://www.crowdfunder.co.uk/return-to-sport,Downey House Return To Sport,Downey House PTA's aim is to bring back after school sports activities and competition for ALL pupils.
78,https://www.crowdfunder.co.uk/fashions-cool,Fashion'S COOL,To aid the Dunbar-based Fashion School in the growth and development of its innovative engagement projects within the community.
79,https://www.crowdfunder.co.uk/one-team--past-present-future,"'One Team'- Past, Present, Future","The ‘One Team’ Project will focus on the rebuilding and future development of our club, Leander Amateur Swimming Club in Northern Ireland."
80,https://www.crowdfunder.co.uk/support-glasgows-refugees,Support Glasgow's Refugees: your Donation Doubled!,"Following the loss of funding for our award-winning Weekend Club for refugees, we’re raising funds to save it!"
81,https://www.crowdfunder.co.uk/in-the-room,In The Room - Short Film,"We are fundraising for an urgent and provocative short film entitled “In The Room”, the debut project of Bar Italia Films."
82,https://www.crowdfunder.co.uk/the-table-community-coffee-shop,Support The Table Community Coffee Shop,"We are a community coffee shop in Walsall town centre, set up to provide a safe, welcoming and warm space for our local community."
83,https://www.crowdfunder.co.uk/communitykettlecic,Community Kettle Empowering People to Connect.,Turning an empty large retail unit into an inclusive diverse space where the kettle is on encouraging all ages to come and share experiences
84,https://www.crowdfunder.co.uk/support-the-elderly-against-he,Support the elderly against heat poverty,"Our aim is to reduce heat poverty in our local area for the most vulnerable people in our community, the elderly."
85,https://www.crowdfunder.co.uk/covid-bereaved-must-be-heard-at-the-covid-inquiry,Covid Bereaved MUST be heard at the Covid Inquiry,Donate to help us fight for testimony of bereaved families to be heard and used at the Covid Inquiry this March.
86,https://www.crowdfunder.co.uk/oldbrentwoodsclub-accessforall,Old Brentwoods Club: Access for All,To elevate the Old Brentwoods Club's offering to all by improving accessibility to its facilities
87,https://www.crowdfunder.co.uk/bodmincollegepresents,The 'Bodmin College Presents' Radio Mics Project,"Bodmin College Performing Arts are striving to purchase of a set of Radio Mics for their musicals, showcases, concerts and exam assessments."
88,https://www.crowdfunder.co.uk/where-now-a-dark-wood-stands,Where Now A Dark Wood Stands,Join me to create a music video about Scotland's journey from monoculture timber plantations to more diverse landscapes
89,https://www.crowdfunder.co.uk/cody-23,CODY 23 COMMUNITY FUND,The CODY 23 Community fund is a project aimed to create a legacy in the memory of Stratford Town FC player Cody Fisher.
90,https://www.crowdfunder.co.uk/tgc-transformational-nature-connection,Help us deliver transformational nature connection,"We run fun, immersive programmes to get urban children into nature for health, happiness and to inspire a long term care of the environment."
91,https://www.crowdfunder.co.uk/funding-reforestion-of-cornwall,Funding the Reforestation of Cornwall,"Plant One is reforesting Cornwall, the most deforested county in the UK. Funding allows the business to become fully financially independant"
92,https://www.crowdfunder.co.uk/british-longboard-surf-team,British Longboard Surf Team - ISA World Champs '23,We are raising funds to help the British Longboard Surf Team to get to the 2023 ISA World Champs in El Salvador
93,https://www.crowdfunder.co.uk/thefootballtribe,The Football Tribe Documentary Film,We're making a feature documentary that explores the different ways in which people around the world express themselves through football.
94,https://www.crowdfunder.co.uk/hallow-fields,Hallow Fields - 45 acres for nature and people,"To restore 45 acres of farmland to nature-rich grassland, orchards, marsh, and woodland, for wildlife & everyone."
95,https://www.crowdfunder.co.uk/talks-at-the-lane,TALKS AT THE LANE,Support Season 2 of TALKS AT THE LANE
96,https://www.crowdfunder.co.uk/pwb-a-safe-space-for-lgbtq-asylum-seekers,PWB: A Safe Space for LGBTQ+ Asylum Seekers,"We provide a safe space for LGBTQ+ people seeking asylum to be themselves and build a new, fulfilling life in Bristol"
97,https://www.crowdfunder.co.uk/harpsouthend,A safe place for people sleeping rough in Southend,"To provide a safe, warm space for people forced to sleep rough in Southend, and to keep our doors open for everyone who needs our support."
98,https://www.crowdfunder.co.uk/solo-unsupported-expedition-to-the-south-pole,"Solo, Unsupported Expedition to the South Pole","This November, I will ski over 700 miles on a solo, unsupported expedition to the South Pole."
99,https://www.crowdfunder.co.uk/eccleston-led-tennis-lights-upgrade,Eccleston Park Tennis Club Greener Tennis Lighting,"Our project aims to upgrade Eccleston Park Tennis Clubs floodlights to energy-efficient LED, improving playing experience and reducing costs"
100,https://www.crowdfunder.co.uk/change-your-story-change-for-life,Change your Story – Change for Life,Change your Story – Change for Life. Changing Lifes is raising money to provide trauma informed support to unemployed women
101,https://www.crowdfunder.co.uk/help-me-keep-periwinkle-and-clay-alive-prize-draw,Help me keep Periwinkle and Clay Alive Prize Draw,Help me stop the leasing company take my UV printer away from me.  Without the printer I loose 90% of my product range and the tiled frames.
102,https://www.crowdfunder.co.uk/tnn-together,Tír na nÓg Together 2023,Tír na nÓg Together will deliver new & innovative initiatives to re-energise our community through inclusion & active opportunities for all.
103,https://www.crowdfunder.co.uk/st-peters-heat-pump-1,St Peter's Heat Pump,We would like to install an environmentally friendly air source heat pump as the existing gas heating system is in need of replacement
104,https://www.crowdfunder.co.uk/rgu-community-sports-project,RGU Community Sports Project,"Vital funds will support our Club to build back better from the Covid19 pandemic, allowing us to enhance programmes for young people locally"
105,https://www.crowdfunder.co.uk/holt-rfc-night-owls,Help Holt RFC keep shining a light on rugby talent,"To replace our floodlighting to eco-friendly and economical units, help save the planet and our members' money, and keep rugby affordable."
106,https://www.crowdfunder.co.uk/get-help-yourself-to-the-edinburgh-fringe,"Get ""Help Yourself"" to the Edinburgh Fringe!","We need help to fund a Fringe run for ""Help Yourself"" - a brand new show by Glasgow-based theatre makers Jess Brodie & Victoria Bianchi!"
107,https://www.crowdfunder.co.uk/income-crisis-and-well-being-support-programme-1,Income Crisis and Well-Being Support Programme,We are seeking for additional funding to enable a continuation of our Income Crisis and Well-Being Support Programme for 12 more months.
108,https://www.crowdfunder.co.uk/connecting-with-our-coast,Connecting with our Coast,"Activities and resources that lead to positive change for our marine wildlife and habitats, and the people who live alongside them"
109,https://www.crowdfunder.co.uk/gwersyllt-park-cricket-club-inclusive-facilities,Gwersyllt Park Cricket Club Inclusive Facilities,"Transforming one of the oldest Cricket Clubs in North Wales into a modern, accessible and inclusive sports hub for the local community."
110,https://www.crowdfunder.co.uk/wellbeing-hub---bridging-communities-together,Wellbeing Hub - Bridging Communities together,"We aim to deliver community cooking sessions to support individuals and families who are experiencing, or at risk of hardship."
111,https://www.crowdfunder.co.uk/how-to-blow-a-childs-mind,Fight for Children's Writes!,"We need to raise £30,000 to continue to deliver our FREE creative writing workshops to children."
112,https://www.crowdfunder.co.uk/support-strong-island-clothing-co,Support Strong Island Clothing Co,We need your support to take Strong Island to the next level by setting up a professional in-house studio to print our own products.
113,https://www.crowdfunder.co.uk/hike-against-hunger,Hike Against Hunger,"In the UK last year, unbelievably over 1 in 10 households used Food banks. A third of these people are children."
114,https://www.crowdfunder.co.uk/stump-up-for-trees,Woodland Creation - sharing the good news,Help us share the good news about the multiple benefits of woodland creation being planted by landowners and communities in South Wales
115,https://www.crowdfunder.co.uk/locker-rewards,Locker Rewards,"Love swimming at Faversham Pools? Then, you are going to LOVE these rewards!"
116,https://www.crowdfunder.co.uk/help-us-open-leavened-bakery-shop-in-old-town,Help us open Leavened bakery shop in Old Town,We are opening a little bakery shop in Stevenage Old Town and need your help setting it up!
