,href,title,description
708,https://www.crowdfunder.co.uk/discovering-hnd-airport-with-the-hnd-team,Discovering HND Airport with the HND team,Discover HND Airport for Comic Relief
709,https://www.crowdfunder.co.uk/refund-for-brad-gale,Refund for Brad Gale,Brad had to give 30p Lee £1500 for stating he was kicked out of Labour for Anti-Social behaviour
710,https://www.crowdfunder.co.uk/derek-davis-independent-babergh-elections-4-may-2,Derek Davis Independent Babergh election May 2023,Derek is seeking re-election as your Ganges (Shotley & Erwarton) ward member for Babergh on 4 May 2023 and needs to fund election material
711,https://www.crowdfunder.co.uk/support-the-hunger,Support The Hunger at Assembly,"Get our Northern based, female-led team to our dream venue! Your help will let us shake up Fringe 2023 with a gutsy festival debut."
712,https://www.crowdfunder.co.uk/an-evening-with-kyiv-city-ballet,An Evening with Kyiv City Ballet,Support the partnership between Kyiv City Ballet and York Theatre Royal.
713,https://www.crowdfunder.co.uk/the-last-sprint-or-i-will-lose-the-race,The Last Sprint or I will lose the race.,I am starting my second write-up years -I am late due to having to put the studies on-hold for a major spine surgery. Please help.
714,https://www.crowdfunder.co.uk/air-partner-gatwick-to-paris-charity-bike-ride-2,Air Partner Gatwick to Paris Charity Bike Ride,"On the 8th of June, a team of 60 riders will set off from Air Partner in Gatwick and cycle to Paris in aid of 3 amazing cancer charities."
715,https://www.crowdfunder.co.uk/longer-life-for-our-much-loved-father,Longer Life for our much loved father,For us to have the treatment that may save Dad's life and give him a fighting chance to live and be well.
716,https://www.crowdfunder.co.uk/abseiling-from-i360,Abseiling from i360,Raising (& lowering) myself down the i360 to raise funds for my beautiful friend Sarah challenged by breast cancer
717,https://www.crowdfunder.co.uk/girl-plays-jazz-project-cic,Girl Plays Jazz Project CIC,Girl Plays Jazz Project is a not for profit organisation dedicated to introducing girls and young women to jazz improvisation.
718,https://www.crowdfunder.co.uk/for-my-school-madrasa,For My School/ Madrasa,Help toward running cost of my Madrash/ school
719,https://www.crowdfunder.co.uk/solidarity-with-shamim-1,Solidarity With Shamim,Climate justice champion - Shamim - faces dangerous threat of homelessness  - can the climate movement of the Global North support her?
720,https://www.crowdfunder.co.uk/step-challenge-in-china,Step Challenge in Shanghai,Steps for Comic Relief
721,https://www.crowdfunder.co.uk/ibrahim-is-fundraising-for-mufg-london-to-torquay,Ibrahim's MUFG London to Torquay 3-day cycle,"London to Torquay cycle challenge for Laureus Sport for Good and Street League, helping disadvantaged young people through sport."
722,https://www.crowdfunder.co.uk/esher-cricket-club---additional-funding-nets,Esher Cricket Club - Additional Funding (Nets),"To raise funds to cover costs of the new nets development, lessening the need for excessive debt financing."
723,https://www.crowdfunder.co.uk/eco-be-zero-waste-shop,Eco Be Dorking Zero Waste Shop,"The aim is to raise £20,000 to support our zero waste shop here in Dorking, making it a hub for sustainability for the community."
724,https://www.crowdfunder.co.uk/sasha-lexi-leia-sophie,Team Tamworth,"We're raising money for our gymnastics club, Tamworth Olympic Gymnastics Club."
725,https://www.crowdfunder.co.uk/how-to-survive-and-thrive-at-edinburgh-fringe,How To Survive and Thrive at Edinburgh Fringe,"Help us get our interactive wellbeing show, ""How to Survive and Thrive in an Impossible World - with a piano!"", to Edinburgh Festival Fringe"
726,https://www.crowdfunder.co.uk/maryam,Maryam,"Assalamu alaikum! During the blessed month of Ramadan, Maryam will be raising funds for charity by memorising Surah Mulk."
727,https://www.crowdfunder.co.uk/7b7a589a096413a8d31aa55b3503715f,Raising money for George - £250 prize draw voucher,Raising money for George’s radiotherapy treatment.
728,https://www.crowdfunder.co.uk/living-costs-for-my-seriously-injured-best-friend,"Silvia, 30 years old, hit by a car while cycling",Raise money to buy a bed frame and help with rent and food
729,https://www.crowdfunder.co.uk/fightforpeace-champions,Support the boxing champions of tomorrow,We're raising funds to support the elite young Fight for Peace boxers become champions in the ring and champions in life!
730,https://www.crowdfunder.co.uk/st-peters-lego-walk,St Peter’s Lego Walk,To raise money that can be put towards enhancing the learning experience for the children of St Peter's Infant School.
731,https://www.crowdfunder.co.uk/get-tom-beckett-elected-in-cherwell,Get Tom Beckett Elected in Cherwell,We need £350 to to get Tom Beckett Elected to Cherwell District Council.  Please give generously to help Tom displace another Tory.
732,https://www.crowdfunder.co.uk/helping-vulnerable-families-with-inco,Helping families with budgeting  and energy advice,To support vulnerable individuals and families with income maximisation and energy advice and building  their skills for financial wellbeing
733,https://www.crowdfunder.co.uk/relocation-fleeing-domestic-abuse-costs,Relocation fleeing domestic abuse costs,Raising funds for survivors fleeing domestic abuse for relocation costs
734,https://www.crowdfunder.co.uk/delivering-free-talks-on-personal-safety,Delivering free talks on personal safety!,"I am trying to raise funds to help a family in need, living in Kerala, Southern India."
735,https://www.crowdfunder.co.uk/unbridling-women-making-the-film,Unbridling Women -  Filming a Community Ritual,"Raising funds to make a short film of a ritual on White Horse Hill on 30th April, unbridling the voice of the deep, empowered feminine."
736,https://www.crowdfunder.co.uk/support-poetry-london-now-and-double-your-donation,Support Poetry London now and double your donation,"Please support Poetry London. A generous donor has offered to match your gift pound for pound! 1st £1,000 gift gets a Mali Morris print."
737,https://www.crowdfunder.co.uk/may100-2023,May 100 2023,To get 7500 disabled children dancing and advocating for their futures whilst promoting intergenerational volunteering!
738,https://www.crowdfunder.co.uk/creavery-sports-stars,Creavery Sports Stars,"We are a rural school with an emphasis on outdoor learning, seeking to increase our opportunities in sports and outdoor play activities."
739,https://www.crowdfunder.co.uk/keep-g20-works-going,Keep G20 Works going,"To continue to provide young people in the G20 area with hope, opportunity and a space of their own to make positive choices. The money woul"
740,https://www.crowdfunder.co.uk/denby,The Denby CofE First School Fundraiser,To support the mental and physical health of the pupils by hosting an inspirational workshop.
741,https://www.crowdfunder.co.uk/amelia-tanzania2024,Amelia's School Expedition - Tanzania 2024,Raising funds for an expedition to Tanzania in 2024 with Holbrook Academy and Camps International to learn and help people living there.
742,https://www.crowdfunder.co.uk/air-partner-gatwick-to-paris-charity-bike-ride-1,Air Partner Gatwick to Paris Charity Bike Ride,.
743,https://www.crowdfunder.co.uk/our-precious-earth,Recycle Ocean Plastic,I want to convert the ocean plastics I find into new products. Funds from this Crowdfunding page will buy equipment to make this possible.
744,https://www.crowdfunder.co.uk/glocal,GLocal: Restoring Green Communities,"GLocal promotes healthy, thriving communities by preventing and protecting against the impacts of climate change, focusing on local youth."
745,https://www.crowdfunder.co.uk/mikaail-taimoor,Mikaail Taimoor,"Assalamu alaikum! During the blessed month of Ramadan, Mikaail Taimoor has been challenged to memorise the 99 names of Allah, Most High."
746,https://www.crowdfunder.co.uk/help-with-court-fees,Help With Court Fees and Finally Become A Father,I'm looking for help as I'm needing to go to court to be the registered father of my daughter and to finally get to be a dad!
747,https://www.crowdfunder.co.uk/oughtrington-1,Oughtrington Community Primary School Fundraiser,To support the mental and physical health of the pupils by hosting an inspirational workshop.
748,https://www.crowdfunder.co.uk/london-marathon-charity-prizedraw-for-leukaemia-uk-1,London Marathon Charity Prize Draw for LeukaemiaUk,To raise money for Leukemia UK as part of my fundraising for the London Marathon on 23rd April
749,https://www.crowdfunder.co.uk/the-spark-project,The Spark Project,"We hope to shed light on ourselves and the parts we keep hidden as both women and performers through comedy, dance, film, acting and theory."
750,https://www.crowdfunder.co.uk/help-fund-portaloos-at-the-start-of-the-k2t-trail,Help fund portaloos at the start of the K2T trail,The aim is to raise funds to help keep portaloos in place at the start of the Keswick to Threlkeld Trail.
751,https://www.crowdfunder.co.uk/opreste-durerea-unei-fetite-ramase-fara-mama,Opreste durerea unei fetite ramase fara mama!,"Galati, accident feroviar tragic. Ajuta o fetita ramasa fara mama, sa-si poata continua studiile."
752,https://www.crowdfunder.co.uk/meadow-rescue,Meadow rescue: Help save our wildflower meadows,"Help us expand wildflower-rich habitats in the Yorkshire Dales, support thousands of species of wildlife and tackle climate change."
753,https://www.crowdfunder.co.uk/developing-the-project-seagrass-nursery,Developing the Project Seagrass nursery,"To scale up research, more pond space is required. Help Project Seagrass take seagrass restoration in the UK to the next level."
754,https://www.crowdfunder.co.uk/fancydresswalk-thedancecomplex,Fun Fancy Dress Sponsored Walk - The Dance Complex,"As a team we will be doing a fancy dress sponsored walk, all proceeds raised will go to kit for kids Clydesdale."
755,https://www.crowdfunder.co.uk/ifza-fatima,Ifza fatima,"Assalamu alaikum! During the blessed month of Ramadan, Ifza fatima has been challenged to memorise the 99 names of Allah, Most High."
756,https://www.crowdfunder.co.uk/al-iman-community-education-services,Al Iman Community Education Services,My aim is to support this establishment that we are so lucky to have in our community.
757,https://www.crowdfunder.co.uk/limbe,LIMBE,"We've organised an exhibition to raise funds for a beach cleanup in Cameroon, our aim is to raise awareness of the plastic issue in Africa."
758,https://www.crowdfunder.co.uk/2x-tickets-to-bruce-springsteen-at-the-rds-dublin,2x Tickets to Bruce Springsteen at the RDS Dublin,"I'm running this prize draw to raise money to get the play ""Scaredy Fat"" to the Edinburgh Fringe..."
759,https://www.crowdfunder.co.uk/the-big-walk-for-the-big-build,The Big Walk for the Big Build,At Beccehamians RFC we want to raise money for the clubhouse extension which will provide women's changing facilities
760,https://www.crowdfunder.co.uk/donation-genie,Donation Genie,"Summer is a time of need.   This campaign is to keep a flow of targeted donations of food, with items most in demand. donation-genie.co.uk"
761,https://www.crowdfunder.co.uk/lawford,The Lawford CofE Primary School Fundraiser,To support the mental and physical health of the pupils by hosting an inspirational workshop.
762,https://www.crowdfunder.co.uk/help-us-buy-food-for-eid-al-fitr-at-eu-borders,Help us buy food for Eid Al-Fitr at EU borders!,Help us buy food for Eid Al-Fitr to distribute to People on the Move in unofficial camps along the Northern Serbian EU-border.
763,https://www.crowdfunder.co.uk/british-pony-club-world-championships,British Pony Club World Championships,"The aim is to help fund a brilliant young rider, selected for the Welsh National Pony Club team World Championships in Denmark, in 2024"
764,https://www.crowdfunder.co.uk/expansion-of-anastasias-pantry-granola-company,Expansion of Anastasia's Pantry Granola Company,"What you kindly pledge towards Anastasia’s Pantry will be used to excel the growth of our healthy, delicious, allergen-friendly products"
765,https://www.crowdfunder.co.uk/ncr-coronation-street-party,NCR CORONATION STREET PARTY,This is to allow us to hold another Street Party. We understand the importance of communities and neighbours coming together.
766,https://www.crowdfunder.co.uk/help-colins-foal-fund,Help Colin's Foal fund,We are hoping to help Colin pay for his Foal's vets bill after the Foal was born early.
767,https://www.crowdfunder.co.uk/get-isabella-to-rio,Get Isabella to Rio!,Our amazingly talented Para-Swimmer Isabella has been asked by ESSA to compete in Rio De Janeiro in the World games in August!
768,https://www.crowdfunder.co.uk/forgive-me,Forgive Me,Forgive Me is a physical performance with live gaming. It combines pole and projection to explore the link between autism and gaming.
769,https://www.crowdfunder.co.uk/restoringrelationships,Restoring Relationships,Restoring and strengthening relationships within communities across Portsmouth and the surrounding area.
770,https://www.crowdfunder.co.uk/get-pinched-to-the-fringe,Help me get 'Pinched' to the Fringe,"I am determined and excited to bring 'Pinched', my debut solo show to the uniquely fantastic stage that is the Edinburgh Fringe, this August"
771,https://www.crowdfunder.co.uk/dalgety-bay-community-pump-track,Dalgety Bay Community Pump Track,"Development of an open access, free to use pump track for Dalgety Bay."
772,https://www.crowdfunder.co.uk/hope-for-strays-foundation-needs-your-help,'Hope for strays' foundation needs your help!,To raise enough money to build a new pen for the 86 dogs currently living in som's home!
773,https://www.crowdfunder.co.uk/niallsdraw,Messi x Niall Prize Draw,"This prize draw is being run to raise money for SGT Police FCs under 18 and 1st team player, Nialls rehabilitation following an ankle break"
774,https://www.crowdfunder.co.uk/the-meadow,The Meadow Fundraising Prize Draw,"Raising funds for The Meadow. A self-directed, consent-based learning community."
775,https://www.crowdfunder.co.uk/wearedisplaced,Displaced,To run workshops and create a game exploring the intersection of ethnic identity and mental health with those forced to migrate.
776,https://www.crowdfunder.co.uk/lily-and-ellies-10k-run,Lily and Ellie’s 10k for WTHC,We want to help raise money for our new pitch and do our part as two members of the Wisbech hockey club.
777,https://www.crowdfunder.co.uk/ramadan-bekaa-valley,Ramadan: meals for families in the Bekaa Valley,Free hot meals for hundreds of the most vulnerable families in Lebanon. Just £30 gives five whole families a delicious dinner this Ramadan.
778,https://www.crowdfunder.co.uk/hafsa,Hafsa,"Assalamu alaikum! During the blessed month of Ramadan, Hafsa will be raising funds for charity by memorising Surah Mulk."
779,https://www.crowdfunder.co.uk/scc-u9s-sponsored-walk,Sponsored Walk,We are Standish CC Under 9's and we are doing a sponsored walk to raise much needed funds for our Cricket Club!
780,https://www.crowdfunder.co.uk/help-save-levi,Help Save Levi,"Spinal surgery to save our beautiful blue boy, our devoted family dog."
781,https://www.crowdfunder.co.uk/fighting-5g-including-ltn-ulez-etc-and-5g,"Fighting 5G including LTN, ULEZ, Smart City","By education through presentations and workshops, raise awreness of the negative effects in communities of LTN, ULEZ, 15-minute zones and 5G"
782,https://www.crowdfunder.co.uk/just-festival,Just Festival,"Just Festival is a multi-arts festival with a focus on human rights and social justice, and celebrates humanity through arts and dialogue."
783,https://www.crowdfunder.co.uk/air-partner---london-to-paris-charity-ride,AIR PARTNER - LONDON TO PARIS CHARITY RIDE,We are cycling from London to Paris June 8-11 to raise funds that will aid & support the St. Jude's Children's Hospital.
784,https://www.crowdfunder.co.uk/no2nato-scotland-launch,No2Nato Scotland launch,To raise money for the launch meeting of No2Nato in Scotland
785,https://www.crowdfunder.co.uk/glenfrome,The Glenfrome Primary School Fundraiser,To support the mental and physical health of the pupils by hosting an inspirational workshop.
786,https://www.crowdfunder.co.uk/north-walsham-5k-park-run-nwfcgirlsu13s-remy,NWFC Girls U13s 5K Park Run,Raising money for Remy's Foundation
787,https://www.crowdfunder.co.uk/tsaptravel,TSAP Travel Madagascar Community Development,"Empowering students and graduates across the UK to gain unique work experience in Madagascar, ensuring brighter futures for all."
788,https://www.crowdfunder.co.uk/get-up-give-back-2023---hike-against-hunger-1,Get Up Give Back 2023 - Hike Against Hunger,"Our aim is to raise £127,264 in only 12 weeks! We'll be pushing ourselves physically & mentally, raising funds for food. #HikeAgainstHunger"
789,https://www.crowdfunder.co.uk/pride-in-the-port-23,Pride in the Port 23,"We are a community group that wants to create a safe, friendly and enjoyable event for the LGBTQIA+ community in Newport"
790,https://www.crowdfunder.co.uk/lochgoilhead-sea-defences-1,Lochgoilhead Sea Defences,Our sea defences are collapsing. We need to strengthen them to save our village green and the iconic viewpoint it provides.
791,https://www.crowdfunder.co.uk/tom-and-jordy-on-another-whirlwind-adventure,We are hiking 26 miles of the Jurassic coast,We want to raise £500 for Macmillan and Mind by hiking 26 miles of the Jurassic Coast on the 13th May
792,https://www.crowdfunder.co.uk/danfmdatabases,New PC for FM Databases,"My 8 year old gaming laptop us really starting to struggle when editing databases on FM, the money raised will go towards a new PC"
793,https://www.crowdfunder.co.uk/awesomefoursome,Awesome Foursome,"To buy presents for Chris, Keeley, Matt & John"
794,https://www.crowdfunder.co.uk/art-of-movement-needs-your-help-to-keep-growing,Art of Movement needs your help to keep growing!,"After 2.5 years, we have now out grown our mat space and need a little help  to offer a bigger training area to our students!"
795,https://www.crowdfunder.co.uk/tssauk-sports-academy-for-north-east,Sports Projects for North and East Sri Lanka,"To achieve our aims and objectives, TSSA members and friends have organised the Walkathon on 4th June 2023."
796,https://www.crowdfunder.co.uk/home-church-scotland,Home Church Scotland Building Fund,Please join me and make a difference? Every donation will help. Thank you in advance for your contribution to this cause that means so much
797,https://www.crowdfunder.co.uk/neave-ross---wbsc-u9-lionesses-wildcats,NEAVE ROSS - WBSC U9 Lionesses / Wildcats,We are raising funds to give Neave the send off she deserves on her exciting US adventure.
798,https://www.crowdfunder.co.uk/laet-toughmudder2023,10km Tough Mudder for Tottenham Foodbank,We are running the Tough Mudder 10km event! To support the work of Tottenham Foodbank who provide for people most in need in our community.
799,https://www.crowdfunder.co.uk/zahra,Zahra,"Assalamu alaikum! During the blessed month of Ramadan, Zahra  will be raising funds for charity by memorising Surah Mulk."
800,https://www.crowdfunder.co.uk/rwanda-fundraiser-2023,Rwanda Fundraiser 2023,"I'm hoping to raise money for a nursery and the local community in Butare, Rwanda."
801,https://www.crowdfunder.co.uk/vestey-holdings-prize-draw-for-chance-to-shine,Vestey Holdings Prize Draw for Chance to Shine,"Welcome to the Vestey Holdings Prize Draw with 4 fantastic prizes to be won, as we help to fundraise for our Charity Partner Chance to Shine"
802,https://www.crowdfunder.co.uk/emilys-50th-birthday,Emily's 50th birthday,Wondering what to get Emily for her half century? Why not contribute to something we know she wants - a personalised memory ring.
803,https://www.crowdfunder.co.uk/london-fragments-street-photo-exhibition,'London Fragments' Street Photo Exhibition,"Exhibition of my unique street photography of London, to open in Greenwich at artFix. My first photo exhibition in my life! And a photo-book"
804,https://www.crowdfunder.co.uk/80km,80km Bike Challenge to Help TOGC Bounce Back!,"I am raising money to support my gym, Tamworth Olympic Gymnastics Club, 'Bounce Back' after smoke damage from a terrible fire. #TeamTamworth"
805,https://www.crowdfunder.co.uk/original-painting-we-see-ewe-by-laura-quiggan,Original painting “We See Ewe by Laura Quiggan,I'm running this prize draw to raise money for... Lotus Lamb & Sheep Sanctuary to raise money for a new over winter home for the residents
806,https://www.crowdfunder.co.uk/qvc---contact-centre-raffle,QVC - Contact Centre Raffle,I am raising money for a charitable cause that is very important to me so please donate and help me reach my target
807,https://www.crowdfunder.co.uk/the-endo-fight-to-mountain-hikes,The ‘Endo’ Fight to Mountain Hikes,Fighting Endometriosis so that I can rediscover my love for hiking and mountain views!
808,https://www.crowdfunder.co.uk/theeternalfront,The Eternal Front,"To become established as a political party in the interests of nationalism, the restoration of traditional values and spirituality."
809,https://www.crowdfunder.co.uk/create-the-biggest-supplements-research-platform,Create the biggest supplements research platform,"We want to create a powerful platform for health practitioners to research supplements, prot. powders, their ingredients within a few clicks"
810,https://www.crowdfunder.co.uk/home-sweet-hell-crowdfunder,Home Sweet Hell Crowdfunder,"We are raising money to develop Home Sweet Hell, a poetry and theatre show written and performed by Maedb Joy from Sexquisite Events."
811,https://www.crowdfunder.co.uk/mufg-london-to-torquay-3-day-pedalathon-o,Lee C : MUFG London to Torquay 3-Day Pedalathon,"Through donating our most precious gift, our free time, to others through worthy CSR initiative, everyone benefits.  Please support me!"
812,https://www.crowdfunder.co.uk/attachment-the-leech-show,Attachment: The Leech Show - EdFringe23,We're fundraising to bring ourselves and our show to the Edinburgh Fringe 2023!
813,https://www.crowdfunder.co.uk/mufg-london-to-torquay-cycle-2023,MUFG London to Torquay cycle 2023,MUFG cyclists are raising funds for local charity partners across EMEA
814,https://www.crowdfunder.co.uk/paul-ashby-memorial-bench,Paul Ashby Memorial Bench,"My brothers memorial bench is in disrepair! We would love to get him a new one, so we can still sit beside his grave and remember him!"
815,https://www.crowdfunder.co.uk/rizgari-community-centre-iraq,Rizgari Community Centre,To raise enough funds for the repair and refurbishment of the community centre in Rizgari - a marginalised Gypsy village in Iraqi Kurdistan.
816,https://www.crowdfunder.co.uk/stmichaels,The St Michael's CofE School Fundraiser,To support the mental and physical health of the pupils by hosting an inspirational workshop.
817,https://www.crowdfunder.co.uk/muhammad-saeed,Muhammad Saeed,"Assalamu alaikum! During the blessed month of Ramadan, Muhammad Saeed has been challenged to memorise the 99 names of Allah, Most High."
818,https://www.crowdfunder.co.uk/safer-folk-dance-spaces,Creating safer DIY folk dance spaces,To raise funds for an online training session about practical skills for creating Safer DIY folk dance spaces.
819,https://www.crowdfunder.co.uk/guildford-waverley-elections-fundraiser-2023,Guildford & Waverley Elections Fundraiser 2023,To raise funds to contribute to the cost of an election campaign and help get more Green Party Councillors elected in Guildford & Waverley.
820,https://www.crowdfunder.co.uk/the-refinery,The Refinery,"To help with social issues surrounding Homelessness, Mental Health and Domestic Abuse."
821,https://www.crowdfunder.co.uk/westfield-primary-community-school-ks2-fruit-fund-1,Westfield Primary Community School KS2 Fruit Fund,Our project aims to provide free fruit to all of our KS2 children (Y3-Y6) every break time.
822,https://www.crowdfunder.co.uk/sptvuk,Keep SPtv Alive and Free,The aim is to raise enough funds to purchase a brand new graphics card and power unit to keep SPtv going.
823,https://www.crowdfunder.co.uk/matts-birthday-surprise,Matt's birthday surprise.,It's Matt's birthday coming up and we want to treat him to something really special...
824,https://www.crowdfunder.co.uk/help-ukraine-20233,Help Ukraine,Our aim to continue to support the citizens and defenders of Ukraine as they continue their fight for freedom and lives.
825,https://www.crowdfunder.co.uk/craig-and-air-partners-gatwick-to-paris-charity-b,Craig's Charity Bike Ride,"Between 8th June and 11th June, I will be cycling from Gatwick to Paris in memory of three colleagues who we sadly lost to cancer in 2022."
826,https://www.crowdfunder.co.uk/eynsford-kings-coronation-firework-display,Eynsford King's Coronation Firework display,To raise money for Eynsford Village Hall
827,https://www.crowdfunder.co.uk/ammatullah,Ammatullah,"Assalamu alaikum! During the blessed month of Ramadan, Ammatullah will be raising funds for charity by memorising Surah Mulk."
828,https://www.crowdfunder.co.uk/freeusekitchencamp,Free Use Kitchen Camp at Burning Nest 2023,"Create a new community resource and camp at Burning Nest 2023: a communal kitchen with shared equipment, gas and other essentials."
829,https://www.crowdfunder.co.uk/olivers-triathlon,Oliver’s triathlon,I am raising money to help my hockey club renew their pitch.
830,https://www.crowdfunder.co.uk/help-re-elect-steve-bridger,Help re-elect Steve Bridger in Yatton ward,"Help re-elect Steve Bridger as an independent and influential voice for Yatton, Claverham, Kingston Seymour & Kenn on North Somerset Council"
