,href,title,description
233,https://www.crowdfunder.co.uk/sheffield-food-drink-prize-draw-for-jude,Sheffield food & drink prize draw for Jude,We're raising money to pay for Jude to take part in Cancer treatment trials in Italy and New York later this year.
234,https://www.crowdfunder.co.uk/sussex-torc,Protect Sussex heritage: Iron Age gold torc appeal,Support the Sussex Archaeological Society's appeal to acquire the ‘near Pulborough’ Iron Age gold torc for Barbican House Museum in Lewes.
235,https://www.crowdfunder.co.uk/stitching-out-of-poverty-in-indonesia,Stitching out of poverty in Indonesia,"To end period poverty, our aim is to purchase10 sewing machine for the girls of Al-Kautsar Foundation to make their reusable sanitary pads."
236,https://www.crowdfunder.co.uk/london-thunder-replacement-floor-funding,London Thunder Floor Replacement,Help us fund the replacement of the damaged basketball courts at London Thunder Basketball club.
237,https://www.crowdfunder.co.uk/help-haunt,Help Haunt Publishing,Help Haunt! Times are tough and we need your help to see us through.
238,https://www.crowdfunder.co.uk/stumbling-stones,Stumbling Stones,"A universal story told through one family with words, music and song - of forced migration, loss, identity & hope. Explore with us."
239,https://www.crowdfunder.co.uk/the-tabitha-mary-neal-appeal,The Tabitha Mary Neal Appeal,Training to be an art therapist will build upon my career as an art teacher to children with SEN. This fund will pay for my fees to re train
240,https://www.crowdfunder.co.uk/chesterfield-foodbank,Chesterfield Foodbank Emergency 3-day food parcels,We provide emergency food and essentials to people in need
241,https://www.crowdfunder.co.uk/ready-steady-cook,"Ready, Steady, Cook!","To provide local families an opportunity to learn new cooking skills with our school Chef, to create healthy and affordable family meals."
242,https://www.crowdfunder.co.uk/support-24-hope-street-dance-collective,Support 24 Hope Street Dance Collective,"Keep Liverpool's home for dance artists in the city open! Help our artist collective thrive in a dynamic, collaborative and inclusive space."
243,https://www.crowdfunder.co.uk/il-burattino,Il Burattino,"Our project aims to get us all closer to the soldiers who once fought at war, not knowing whether they would make it."
244,https://www.crowdfunder.co.uk/all-out-fighting-fund,All Out Fighting Fund,To help defeat as many Labour Party politicians as possible in the May 4th All Out Oldham elections.
245,https://www.crowdfunder.co.uk/cambridgenaturefestival2023,Cambridge Nature Festival 2023,To celebrate nature on our doorstep in Cambridge and connect with local communities through a festival of nature based events and activities
246,https://www.crowdfunder.co.uk/seeds-of-change-nepal,Seeds of Change Nepal,Fund 6 agricultural caretakers for remote farming villages in Nepal and lift communities out of poverty while taking climate change action!
247,https://www.crowdfunder.co.uk/bereavement-cookery-club,Bereavement Cookery Club,To deliver inclusive community cookery courses to bereaved adults and families who are struggling with increases in food and energy prices
248,https://www.crowdfunder.co.uk/tortola-torture-23,Tortola Torture (Ben Mellett / Charlie Goldblatt),Tortola Torture (Ben Mellett / Charlie Goldblatt)
249,https://www.crowdfunder.co.uk/chapel-for-saint-jacob-of-farakla-evia-greece,The Chapel of Saint Jacob,"We aim to build a small chapel to Saint Jacob, Farakla's refugee saint, to bring pilgrims and visitors to the village."
250,https://www.crowdfunder.co.uk/help-terra-nova-productions-raise-15000,Help Terra Nova keep the lights on!,Donate now to keep Terra Nova's doors open! We need your support.
251,https://www.crowdfunder.co.uk/opposing-grange-court-development-dc23130280,Opposing Grange Court Development DC/23/130280,We wish to raise funds to acquire professional advice to oppose the Grange Court development.
252,https://www.crowdfunder.co.uk/fishing-2,FISHING,"A film. An art project. A humorous look at suburban crime, fear and social media: two friendly criminals helping themselves, helping you."
253,https://www.crowdfunder.co.uk/saving-the-lives-of-those-fighting-in-ukraine,Tac Med Team saving lives in ukraine,Experienced team of medics and soldiers working in ukraine evacuating civilians and providing medical support on the front lines of freedom.
254,https://www.crowdfunder.co.uk/prevent-holiday-hunger-for-kids-this-winter,Prevent Holiday hunger for Kids this Winter,We need your help to run school holiday clubs for children living below the poverty line in the winter
255,https://www.crowdfunder.co.uk/windows-for-a-warmer-warehouse,Windows for a Warmer Warehouse,"To replace 3+ draughty inefficient windows in our meeting room, saving energy & funds for the many green & social groups that use the space."
256,https://www.crowdfunder.co.uk/support-community-farming-in-bristol,Support community farming in Bristol,"We need support to expand our growers team, sustain community projects and solidarity veg shares, cover tractor training and repair costs."
257,https://www.crowdfunder.co.uk/in-memory-of-craig-weymes-for-his-children,In memory of Craig Weymes for his children,"Raising money for his children who he loved dearly, to help with their future and costs to enable them to travel to his memorial service."
258,https://www.crowdfunder.co.uk/farringtongreenuplift,Farrington Gurney Green Uplift Project,To install 34 solar panels on the roof of the village hall to generate electricity needed for the running of the village hall.
259,https://www.crowdfunder.co.uk/phantasmagorias-path-of-potential,Phantasmagoria's Path of Potential,A creative way of working with the local community to give confidence and skills to get back into work and education.
260,https://www.crowdfunder.co.uk/aldryngton-pta-pool-club-2023-1,Aldryngton PTA Pool Club 2023,This is to pay for your membership of the 2023 PTA pool club AFTER you have submitted your application form. Please use the reward to pay.
261,https://www.crowdfunder.co.uk/the-dodgy-free-peace-sweet-charity-give-away,The DODGY 'Free Peace Sweet' Charity give away,"To mark our first 'Free Peace Sweet' Anniversary tour, Dodgy are raising money for the Refugee Council by giving away a load of rare treats"
262,https://www.crowdfunder.co.uk/edale-skyline-walk-for-drawing-smiles,Edale Skyline Walk for Drawing Smiles,Raising money to help children receive art therapy sessions to aid their well being and mental health.
263,https://www.crowdfunder.co.uk/john-fran-roberts-flying-gliding-world-comp-2023,John & Fran Roberts flying Gliding Worlds 2023,"John and Fran Roberts are both flying in Gliding World Championships this year, 2023.  Please help and contribute if you can."
264,https://www.crowdfunder.co.uk/emerald-abc-club-development-fundraiser,Emerald ABC Club Development Fundraiser,We aim to raise funds for much needed equipment to aid the development of our members and allow us to open our doors to the wider community.
265,https://www.crowdfunder.co.uk/5th-element-1,Run/Ride/Walk 2023,We aim to kickstart fundraising to to replace the mats in our Academy which are vital to all our team.
266,https://www.crowdfunder.co.uk/wellbeingcafe,Wellbeing Cafe,"We host a weekly free hot meal made from surplus food, bringing the community together for food and friendship, and reducing food waste."
267,https://www.crowdfunder.co.uk/friends-of-laly23,Friends of LALY23,Help celebrate the incredible work of new legal aid lawyers and their positive impact for clients as they are the future of the profession
268,https://www.crowdfunder.co.uk/support-plymouth-pride-2023,Support Plymouth Pride 2023,We will bring Plymouth's LGBTQIA+ communities together by hosting a world class inclusive Pride event on Saturday 5 August at Central Park
269,https://www.crowdfunder.co.uk/stc-development,Stocksfield Tennis Club Improvements & Development,Improvements including resurfacing of our 4 courts and improving the perimeter fencing
270,https://www.crowdfunder.co.uk/reclaiming-a-historic-site-as-a-community-asset,Reclaiming a historic site as a community asset,"We are reclaiming a 200 year old historic wooded site, neglected for decades and now also affected by the effects of climate change."
271,https://www.crowdfunder.co.uk/repair-redecorate-and-reinvigorate,Refresh & Reinvigorate our little Club on the Lane,"Our Club desperately needs help so that we can continue to play rugby - we need to repair our roof, sort the heating out and much much more!"
272,https://www.crowdfunder.co.uk/please-help-me-get-home-3,Please help me on my road to recovery!,Raising funds to cover basic costs after an accident in which I broke both ankles simultaneously after an accident in Malta
273,https://www.crowdfunder.co.uk/remain-reunion-summer-boat-party,Remain Reunion Summer Boat Party,To hold a reunion boat party
274,https://www.crowdfunder.co.uk/the-artizan-cafe-and-creative-space,The Artizan Cafe and Creative Space,"The Artizan Cafe and Creative Space aims to provide skills training, friendship, support & work experience for differently able young adults"
275,https://www.crowdfunder.co.uk/sustain-the-future-of-protein-dance,Sustain The Future of Protein Dance,Bolster our resilience and ensure we continue to provide creative ways for us all to connect and express ourselves.
276,https://www.crowdfunder.co.uk/shoreham-u15-football-tour,Shoreham U15's European Football Tour,"An opportunity for the young players to build team spirit, develop their confidence and character, and commitment to the sport."
277,https://www.crowdfunder.co.uk/soul-food-edinburgh-1,Soul Food Edinburgh,"We believe in beautiful, warm, community spaces that hold long tables and offer delicious, homemade food."
278,https://www.crowdfunder.co.uk/nabc-community-cafe-warm-welcome,NABC Community Cafe Warm Welcome,We are looking to raise money to fund our Community Cafe which offers a warm welcoming space that feels like home.
279,https://www.crowdfunder.co.uk/graces-playground-ilmington,"Renovation of Grace’s Playground, Ilmington",We want to raise funds to repair and redevelop Grace's Playground in Ilmington so it can continue to be a wonderful place to play.
280,https://www.crowdfunder.co.uk/oldlandcommonproject,Oldland Common Project,"We’re taking Oldland Common station back to the 1960s, with the restoration of original features which will enhance the heritage atmosphere!"
281,https://www.crowdfunder.co.uk/runaway-the-collaboration-sweet-charity-choirs,Runaway: The Collaboration & Sweet Charity Choirs,Watch 2 fabulous choirs doing something 'funny for money' in aid of 2 great causes: The Samaritans Ireland and Comic Relief. Help us!
282,https://www.crowdfunder.co.uk/harieverestappeal,HariEverestAppeal,"In May 2023 I am aiming to be the first double above-knee amputee to climb Everest and raise £884,900 for five amazing charities."
283,https://www.crowdfunder.co.uk/norwich-homeless-support---housing-the-homeless,Norwich Homeless Support -  housing the homeless,To help anyone affected by homelessness  to become more  secure and give the tools and guidance to help their wellbeing.
284,https://www.crowdfunder.co.uk/200-mile-run-through-a-dark-tunnel-to-help-rescued,200-mile run in the dark to help rescued animals,"Hi, I am Mitso and I am challenging myself to run 200 miles under 55 hrs in a dark tunnel to raise money for rescued farm animals."
285,https://www.crowdfunder.co.uk/craigs-cabin-community-volunteers,Craig's Cabin Community Volunteers,The purpose for which the CCCV has been established is to promote positive mental and physical health through outdoor activities
286,https://www.crowdfunder.co.uk/st-patricks-shotts-band-hall-needs-your-help,St Patrick's Shotts' Band Hall Needs Your Help!,We need to raise £2000 for a new boiler
287,https://www.crowdfunder.co.uk/renew-ripon-and-breakfast-club-community-project,Renew Ripon and Breakfast Club Community Project,We are reaching out to Ripon. Supporting families and children with Breakfast Club and adults who need space to just be with Renew Ripon.
288,https://www.crowdfunder.co.uk/keep-treorchy-bgc-warm,Keep Treorchy BGC Warm,The aim of this project is to raise much needed revenue to help cover the massively increased utility bills to keep the clubhouse warm.
289,https://www.crowdfunder.co.uk/new-nets-at-boldon-cricket-club,New Nets at Boldon Cricket Club,In 2022 our net suffered terrible damage when a tree fell on it during a severe windstorm. We want to raise money to build a new 2 lane net.
290,https://www.crowdfunder.co.uk/whats-mine-is-yours,Help me go on tour this June!,I'm looking for support to help me go out on tour around the UK this June!
291,https://www.crowdfunder.co.uk/hayfc,Hay St Mary's Clubhouse and Changing Rooms,"Hay St Mary's is raising money for a new club house to provide changing rooms, toilets, a kitchen and a bar with an indoor viewing area."
292,https://www.crowdfunder.co.uk/the-spark-park,The Spark Park,"To create an outdoor learning environment that inspires children’s learning and play within Science, Technology, Engineering, Art and Maths."
293,https://www.crowdfunder.co.uk/urgent-help-for-ukraine,Urgent Help for Ukraine,"To raise £5,000 to help pay for medical equipment, satellite phones and a drone for use in life-saving situations."
294,https://www.crowdfunder.co.uk/fundraiser-for-turkey-syria,Fundraiser: Turkey–Syria earthquakes,Journal of Visual Culture editorial collective & friends join forces to fundraise for the 2023 Turkey-Syria earthquakes relief effort.
295,https://www.crowdfunder.co.uk/world-record-bowls-match-marathon---62-hours,WORLD RECORD BOWLS MATCH MARATHON - 62 HOURS,To engage more people by improving accessibility and communications and to promote the Lincoln Indoor Bowls Club as a community asset.
296,https://www.crowdfunder.co.uk/warm-your-cockles-community-cafe,Warm Your Cockles Community Hub,"A place to go for people who are struggling or in need of a friendly face and a warm welcome. Nonjudgmental support, free food and drink."
297,https://www.crowdfunder.co.uk/mollys-pantry-is-moving,Molly's Pantry is moving!,"Molly's Pantry is a sustainable grocer, founded in 2020 following Covid job losses, bootstrapped on an initial £160 now we are on the move!"
298,https://www.crowdfunder.co.uk/wightlink-users-group,Wightlink Users Group,"To achieve our aim for a frequent, reliable and affordable ferry service, we need funds for adverts, website, flyers and distribution costs."
299,https://www.crowdfunder.co.uk/public-living-rooms,Public Living Rooms in Middlesbrough,"Public Living Rooms are spaces for simple human connection. In these tough times, looking out for each other can be what gets us through."
300,https://www.crowdfunder.co.uk/rumaysah-faatimah,Rumaysah Faatimah,"Assalamu alaikum! During the blessed month of Ramadan, Rumaysah Faatimah has been challenged to memorise the 99 names of Allah, Most High."
301,https://www.crowdfunder.co.uk/iqra-support-for-turkey-syria,Support for Turkey & Syria,"To give aid to those in need in Turkey & Syria following the earthquakes and destruction. Aid will be cash, food, clothes, shelter, etc."
302,https://www.crowdfunder.co.uk/npnzine,No Permission Needed zine,"Fund the graphic design and launch of 'Scott(ish)', a print and online magazine by 'No Permission Needed'"
303,https://www.crowdfunder.co.uk/irrigation-system-for-community-bowls-gree,Irrigation System for Beechwood Bowls Club,A multi functioning watering system will irrigate our green as opposed to watering small sections one at a time
304,https://www.crowdfunder.co.uk/earlymusicfuture,Early Music Future - Pro Victoria's 2023 campaign,"Aiming to raise half of our 2023 campaign through Crowdfunder, providing essential & invaluable support to our 2023 recording projects."
305,https://www.crowdfunder.co.uk/support-the-uks-first-ever-eating-disorder-march,Support the Uks first ever eating disorder march,To raise money to help support the Uks first eating disorder March including hiring equipment for the rally
306,https://www.crowdfunder.co.uk/kernow-kosovan-connection,BEYOND WORDS - Kernow  Kosovan Connection,"This project is about two small communities, one in Cornwall, one in Kosovo connecting and supporting each other through the arts."
307,https://www.crowdfunder.co.uk/2023-london-marathon,2023 London Marathon,After 20 years of applying I have finally achieved a place in the 2023 London Marathon!This is the largest annual fundraising event on th...
308,https://www.crowdfunder.co.uk/west-dereham-playground-project,West Dereham Playground Project,A Working Group of local parents and grandparents are working with the Parish Council to raise money for a much needed play facility!
309,https://www.crowdfunder.co.uk/gyc-debut-album,Great Yorkshire Chorus Debut Album,The Great Yorkshire Chorus will record a debut album in 2023 to celebrate their 5th anniversary.
310,https://www.crowdfunder.co.uk/localelectioncampaign2023,Local Election Campaign 2023,We are aiming to raise £2000 to help fund the election campaigns in our target wards and convince people to vote Green Party in 2023.
311,https://www.crowdfunder.co.uk/harley-earle-fund,Harley Earle Fund,To help support Harley who will be unable to work and is out injured for the rest of the season due to injury.
312,https://www.crowdfunder.co.uk/laying-a-headstone-for-natasha,A headstone for Natasha,We're raising money to purchase a beautiful headstone for Natasha Phoenix Barry-Daniels.  Natasha passed away on 26th January 2023.
313,https://www.crowdfunder.co.uk/community-green-spaces-gardening-and-planting-pr,"Community  Green spaces ,gardening and planting","Encouraging the community to plant  and enjoy local  BIODIVERSITY, Raise awareness of how important local planting can bring benefits."
314,https://www.crowdfunder.co.uk/st-marks-free-food-market,St Mark's free food market,"Free food market every Tuesday and Saturday, along with warm spaces with free tea and coffee and sandwiches."
315,https://www.crowdfunder.co.uk/upperthong-ji-school-reception-outdoor-provision,Upperthong JI School Reception Outdoor Provision,"Making the grass area a safe place to play and explore-den building, sand and colour Adding rubber crumb and markings for bikes and scooters"
316,https://www.crowdfunder.co.uk/new-kids-boats,New Kids Boats,"Our training boats are becoming unsafe, we are looking to replace them along with a more reliable safety boat."
317,https://www.crowdfunder.co.uk/hedgehog-friendly-campus,Hedgehog Friendly Campus,We want to support disabled students to develop skills & knowledge around conservation through Hedgehog Friendly Campus
318,https://www.crowdfunder.co.uk/bustler-nottingham-expansion,Bustler Nottingham Expansion,Raise funds to expand Bustler Nottingham's offering giving independent food traders the facilities and platform to grow.
319,https://www.crowdfunder.co.uk/bal-maiden-musical,Bal Maiden Musical,"We are staging an original musical in Falmouth - Bal Maiden - in November 2023, involving young people and the community. We need your help!"
320,https://www.crowdfunder.co.uk/behomesoonedfringe,Be Home Soon Edinburgh Fringe,We are raising funds to take the new play ‘Be Home Soon’ by Liliana Newsam-Smith to the 2023 Edinburgh Fringe Festival!
321,https://www.crowdfunder.co.uk/raie-album-number-two-redbrickangels,RAIE album number two Red Brick Angels,"I’m hoping to raise £4,500 to record a second album with award winning Engineer/Producer Wes Maebe at Europe's top studio."
322,https://www.crowdfunder.co.uk/helping-to-keep-the-lights-on,Helping to Keep the Lights On,"Let people know they are not alone in this crisis. Offering good company, warmth, help with energy bills, social activities & more."
323,https://www.crowdfunder.co.uk/astley-pensioners,Astley Old Age Pensioners,To continue to offer a warm and welcoming space for the local community especially for our respected elders.
324,https://www.crowdfunder.co.uk/exeter-kindness-mural,Exeter Kindness Mural,"We aim to create an inspirational mural to fix a run-down wall in Exeter, celebrate generosity, support local charity and orphans in Africa."
325,https://www.crowdfunder.co.uk/enable-glasgow-fortune-works,ENABLE Glasgow: Fortune Works,Fortune Works aims to empower people with a learning disability to achieve their aspirations in life.
326,https://www.crowdfunder.co.uk/the-thomas-project-warm-spaces-and-food-bank,The Thomas Project Warm Spaces and Food Bank,"We will reduce the impact of food, fuel and financial poverty for people by providing a warm space, activities, support and a foodbank."
327,https://www.crowdfunder.co.uk/getntvtocanada,Help NTV play Canada!,Nature TV have been invited to play Toronto?s famous NXNE festival in June 2023!
328,https://www.crowdfunder.co.uk/together-with-yourself-at-sea-level,Together With Yourself At Sea Level,"To release an album, videos & book of music based around a rare 200 year old harp.  This music explores nature, time, identity and optimism."
329,https://www.crowdfunder.co.uk/lord-mayors-portrait,Lord Mayor's Portrait,"We aim to commission a  historic portrait of Jacqui Rayment, the first Lord Mayor of Southampton, to hang in the iconic Civic Centre."
330,https://www.crowdfunder.co.uk/get-orlando-to-new-york,Get Orlando to New York,We're crowdfunding to take Lucy Roslyn's play Orlando to New York in 2023 as part of Brits Off Broadway.
331,https://www.crowdfunder.co.uk/warm-space-the-spearhead-trust-at-bells-farmhouse,Warm Space The Spearhead Trust at Bells Farmhouse,"We aim to provide a warm space to our community Monday - Friday 10am - 3pm. We offer hot meals, wifi, and drinks."
332,https://www.crowdfunder.co.uk/girls-basketball-new-venues---6-12-years-and-13,Girls basketball Greater Manchester - all ages,Funds for basketball resources so that we can give more opportunities to females in basketball which is massively underrepresented in the UK
333,https://www.crowdfunder.co.uk/cooperation-uk,Help seed a new movement: Cooperation UK!,"A new society built on cooperation, solidarity & community. An Alternative to the politics & institutions of our time. Hope. Vision. A plan."
334,https://www.crowdfunder.co.uk/team-bath-racing-electric-2023,Team Bath Racing electric 2023,"To build the fastest, most reliable electric Formula student car in the UK and take it into European competition."
335,https://www.crowdfunder.co.uk/run-for-afghanistan-1,Running for families in poverty in Afghanistan,We are raising money for impoverished families in Afghanistan.
336,https://www.crowdfunder.co.uk/night-of-power-amazing-deeds,Night of Power Amazing deeds,Join Pathway to Jannah in raising donations for a few amazing Project in the last 10 blessed days of Ramadan Donate your Sadqa today
337,https://www.crowdfunder.co.uk/jts-growth-and-development-fund-2023,JTS growth and development fund 2023,We aim to create growth as we strengthen our work with our producer partners and build foundations for the next 10 years of fair trading.
338,https://www.crowdfunder.co.uk/ramadan-fundraiser-for-dialysis-patients-in-need,Ramadan Fundraiser for Dialysis patients in need,To raise money to help sponsor kidney failure patient's dialysis and medications
339,https://www.crowdfunder.co.uk/cyclone-freddy,Urgent aid in the aftermath of Cyclone Freddy,In the aftermath of Cyclone Freddy our team in Malawi are poised to help injured animals. Please help provide urgent veterinary aid.
340,https://www.crowdfunder.co.uk/brighton-and-london-marathons-2023-for-mduk,"Brighton and London Marathons 2023, for MDUK",To raise as much money as possible to improve the lives of those suffering from muscle wasting conditions
341,https://www.crowdfunder.co.uk/artisanmakersvillage,Artisan & Makers Village,"Aim to raise a deposit to secure a farm to turn into a Artisan and Makers Village; providing affordable living, workshop & education spaces."
342,https://www.crowdfunder.co.uk/newboldcc,Launching Newbold Cricket Club's youth programme,"We are launching a youth cricket programme, welcoming people from all backgrounds. We are raising funds for coaching, nets and equipment."
343,https://www.crowdfunder.co.uk/georgian-pipe-organ-overhaul,Save our Georgian Organ!,The aim of our project is to overhaul and recondition the original 200 years old pipe organ and its blower motor and fan c.1940.
344,https://www.crowdfunder.co.uk/eastriggs-primary,London Marathon? Challenge Accepted!,"To raise money for Eastriggs Nursery & Primary School, to help them fund play equipment and school trips."
345,https://www.crowdfunder.co.uk/breathe-minibus-repairs,Breathe Minibus Repairs,We urgently need to raise £5000 for repairs to the 8 seater Nissan Elgrand sold to our youth charity recently in ill faith.
346,https://www.crowdfunder.co.uk/punching-above-our-weight,Punching above our weight,"As a community, we are still a bit 'punch drunk' after lockdown. We want to bounce back stronger and continue to support our young boxers"
347,https://www.crowdfunder.co.uk/help-sentu-wellness-expand-and-grow,Help Sentu Wellness Expand and Grow,"With clients and staff at the centre of our ethos, we would like to expand and grow after 8 months of lockdown in our first year of trading."
348,https://www.crowdfunder.co.uk/teaching-womxn-how-to-build-small-mobile-dwellings,Teaching womxn how to build small mobile dwellings,I am seeking funding to help cover the costs of going to america to study timber framing for tiny houses.
349,https://www.crowdfunder.co.uk/jeromes-litter-picking-project,Jerome's Litter Picking Project,I am raising money for my hockey club to help get across the line with the funding needed to replace the worn out astro-turf pitch.
